{
  "schema_version": "1",
  "generated_at": "2026-03-13T12:00:00Z",
  "tool_version": "0.1.0",
  "status": "failure",
  "decision": "block",
  "summary": "1 changed subject(s): 1 blocked, 0 review, 0 warn, 0 allow.",
  "counts": {
    "changed_subjects": 1,
    "allow": 0,
    "warn": 0,
    "review": 0,
    "block": 1
  },
  "paths": {
    "base": "/Users/nsatyakrishna/Code/OriginFence/fixtures/cases/pypi-quarantined-block/base",
    "head": "/Users/nsatyakrishna/Code/OriginFence/fixtures/cases/pypi-quarantined-block/head"
  },
  "policy": {
    "source": "builtin:default",
    "checksum": "61d8c0dfa5e6e8a9cad63f5e2f9a4ced7fe8e1ef21abed9b0d4893e6632574f8",
    "waivers_file": ".originfence/waivers.yaml"
  },
  "unsupported_files": [],
  "results": [
    {
      "schema_version": "1",
      "subject": {
        "ecosystem": "pypi",
        "name": "unsafe-lib",
        "version": "1.0.0",
        "source_type": "registry",
        "manifest_path": "requirements.txt",
        "lockfile_path": "requirements.txt",
        "top_level": true
      },
      "base_decision": "block",
      "effective_decision": "block",
      "waived": false,
      "summary": "unsafe-lib@1.0.0 is block because unsafe-lib@1.0.0 is marked as quarantined or unsafe upstream.",
      "reasons": [
        {
          "code": "REGISTRY_QUARANTINED",
          "severity": "critical",
          "decision": "block",
          "message": "unsafe-lib@1.0.0 is marked as quarantined or unsafe upstream.",
          "evidence_refs": [
            "ev1"
          ],
          "waivable": false
        }
      ],
      "evidence": [
        {
          "id": "ev1",
          "source": "pypi_json_api",
          "kind": "registry_metadata",
          "ref": "unsafe-lib@1.0.0",
          "fetched_at": "2026-03-13T12:00:00Z"
        }
      ],
      "waivers_applied": [],
      "next_action": {
        "kind": "replace_dependency",
        "summary": "Remove or replace the dependency."
      },
      "evaluation_meta": {
        "evaluated_at": "2026-03-13T12:00:00Z",
        "tool_version": "0.1.0",
        "hard_signal_state": "fresh",
        "soft_signal_state": "fresh",
        "stale_evidence_refs": []
      }
    }
  ]
}
