{
  "schema_version": "1",
  "generated_at": "2026-03-13T12:00:00Z",
  "tool_version": "0.1.0",
  "status": "success",
  "decision": "warn",
  "summary": "1 changed subject(s): 0 blocked, 0 review, 1 warn, 0 allow.",
  "counts": {
    "changed_subjects": 1,
    "allow": 0,
    "warn": 1,
    "review": 0,
    "block": 0
  },
  "paths": {
    "base": "/Users/nsatyakrishna/Code/OriginFence/fixtures/cases/pypi-vcs-valid-waiver/base",
    "head": "/Users/nsatyakrishna/Code/OriginFence/fixtures/cases/pypi-vcs-valid-waiver/head"
  },
  "policy": {
    "source": "builtin:default",
    "checksum": "61d8c0dfa5e6e8a9cad63f5e2f9a4ced7fe8e1ef21abed9b0d4893e6632574f8",
    "waivers_file": ".originfence/waivers.yaml"
  },
  "unsupported_files": [],
  "results": [
    {
      "schema_version": "1",
      "subject": {
        "ecosystem": "pypi",
        "name": "internal-tooling-lib",
        "version": "git+https://github.com/our-org/internal-tooling-lib.git@9f2e1d4",
        "source_type": "vcs",
        "manifest_path": "requirements.txt",
        "lockfile_path": "requirements.txt",
        "top_level": true
      },
      "base_decision": "review",
      "effective_decision": "warn",
      "waived": true,
      "waived_from": "review",
      "summary": "internal-tooling-lib@git+https://github.com/our-org/internal-tooling-lib.git@9f2e1d4 is warn because waiver OF-2026-0002 applies.",
      "reasons": [
        {
          "code": "VCS_SOURCE",
          "severity": "high",
          "decision": "review",
          "message": "internal-tooling-lib@git+https://github.com/our-org/internal-tooling-lib.git@9f2e1d4 is introduced from a VCS source instead of an approved registry.",
          "evidence_refs": [
            "ev1"
          ],
          "waivable": true
        }
      ],
      "evidence": [
        {
          "id": "ev1",
          "source": "resolver",
          "kind": "policy_rule",
          "ref": "git+https://github.com/our-org/internal-tooling-lib.git@9f2e1d4"
        },
        {
          "id": "ev2",
          "source": "pypi_json_api",
          "kind": "registry_metadata",
          "ref": "internal-tooling-lib@git+https://github.com/our-org/internal-tooling-lib.git@9f2e1d4",
          "fetched_at": "2026-03-13T12:00:00Z"
        }
      ],
      "waivers_applied": [
        {
          "id": "OF-2026-0002",
          "owner": "team-platform",
          "justification": "Internal library is still being migrated to a private index",
          "created_at": "2026-03-10T00:00:00Z",
          "expires_at": "2026-03-27T00:00:00Z",
          "reason_codes": [
            "VCS_SOURCE"
          ],
          "effect": "downgrade_to_warn",
          "scope": {
            "ecosystem": "pypi",
            "package": "internal-tooling-lib",
            "version": "git+https://github.com/our-org/internal-tooling-lib.git@9f2e1d4"
          }
        }
      ],
      "next_action": {
        "kind": "track_waiver",
        "summary": "Track waiver OF-2026-0002 until expiry or remove the dependency."
      },
      "evaluation_meta": {
        "evaluated_at": "2026-03-13T12:00:00Z",
        "tool_version": "0.1.0",
        "hard_signal_state": "fresh",
        "soft_signal_state": "fresh",
        "stale_evidence_refs": []
      }
    }
  ]
}
