{
  "schema_version": "1",
  "generated_at": "2026-03-13T12:00:00Z",
  "tool_version": "0.1.0",
  "status": "failure",
  "decision": "block",
  "summary": "1 changed subject(s): 1 blocked, 0 review, 0 warn, 0 allow.",
  "counts": {
    "changed_subjects": 1,
    "allow": 0,
    "warn": 0,
    "review": 0,
    "block": 1
  },
  "paths": {
    "base": "/Users/nsatyakrishna/Code/OriginFence/fixtures/cases/npm-source-denied-and-confusion/base",
    "head": "/Users/nsatyakrishna/Code/OriginFence/fixtures/cases/npm-source-denied-and-confusion/head"
  },
  "policy": {
    "source": "builtin:default",
    "checksum": "61d8c0dfa5e6e8a9cad63f5e2f9a4ced7fe8e1ef21abed9b0d4893e6632574f8",
    "waivers_file": ".originfence/waivers.yaml"
  },
  "unsupported_files": [],
  "results": [
    {
      "schema_version": "1",
      "subject": {
        "ecosystem": "npm",
        "name": "weird-pkg",
        "version": "9.9.9",
        "source_type": "registry",
        "manifest_path": "package.json",
        "lockfile_path": "package-lock.json",
        "top_level": true
      },
      "base_decision": "block",
      "effective_decision": "block",
      "waived": false,
      "summary": "weird-pkg@9.9.9 is block because weird-pkg@9.9.9 resolves from a source outside the approved registry set.",
      "reasons": [
        {
          "code": "SOURCE_DENIED",
          "severity": "high",
          "decision": "block",
          "message": "weird-pkg@9.9.9 resolves from a source outside the approved registry set.",
          "evidence_refs": [
            "ev1"
          ],
          "waivable": false
        }
      ],
      "evidence": [
        {
          "id": "ev1",
          "source": "policy",
          "kind": "policy_rule",
          "ref": "allowed_sources:evil.example.com"
        },
        {
          "id": "ev2",
          "source": "npm_registry",
          "kind": "registry_metadata",
          "ref": "weird-pkg@9.9.9",
          "fetched_at": "2026-03-13T12:00:00Z"
        }
      ],
      "waivers_applied": [],
      "next_action": {
        "kind": "use_approved_source",
        "summary": "Use an approved registry source."
      },
      "evaluation_meta": {
        "evaluated_at": "2026-03-13T12:00:00Z",
        "tool_version": "0.1.0",
        "hard_signal_state": "fresh",
        "soft_signal_state": "fresh",
        "stale_evidence_refs": []
      }
    }
  ]
}
