{
  "schema_version": "1",
  "generated_at": "2026-03-13T12:00:00Z",
  "tool_version": "0.1.0",
  "status": "failure",
  "decision": "block",
  "summary": "1 changed subject(s): 1 blocked, 0 review, 0 warn, 0 allow.",
  "counts": {
    "changed_subjects": 1,
    "allow": 0,
    "warn": 0,
    "review": 0,
    "block": 1
  },
  "paths": {
    "base": "/Users/nsatyakrishna/Code/OriginFence/fixtures/cases/unsupported-pnpm/base",
    "head": "/Users/nsatyakrishna/Code/OriginFence/fixtures/cases/unsupported-pnpm/head"
  },
  "policy": {
    "source": "builtin:default",
    "checksum": "61d8c0dfa5e6e8a9cad63f5e2f9a4ced7fe8e1ef21abed9b0d4893e6632574f8",
    "waivers_file": ".originfence/waivers.yaml"
  },
  "unsupported_files": [
    "pnpm-lock.yaml"
  ],
  "results": [
    {
      "schema_version": "1",
      "subject": {
        "ecosystem": "npm",
        "name": "pnpm-lock.yaml",
        "version": null,
        "source_type": "unknown",
        "lockfile_path": "pnpm-lock.yaml",
        "top_level": true
      },
      "base_decision": "block",
      "effective_decision": "block",
      "waived": false,
      "summary": "OriginFence does not support pnpm-lock.yaml in v1.",
      "reasons": [
        {
          "code": "UNSUPPORTED_PROJECT_FORMAT",
          "severity": "high",
          "decision": "block",
          "message": "OriginFence does not support pnpm-lock.yaml in v1.",
          "evidence_refs": [
            "ev1"
          ],
          "waivable": false
        }
      ],
      "evidence": [
        {
          "id": "ev1",
          "source": "resolver",
          "kind": "policy_rule",
          "ref": "UNSUPPORTED_PROJECT_FORMAT:pnpm-lock.yaml"
        }
      ],
      "waivers_applied": [],
      "next_action": {
        "kind": "use_supported_format",
        "summary": "Use a supported lockfile or requirements format before enabling OriginFence."
      },
      "evaluation_meta": {
        "evaluated_at": "2026-03-13T12:00:00Z",
        "tool_version": "0.1.0",
        "hard_signal_state": "fresh",
        "soft_signal_state": "fresh",
        "stale_evidence_refs": []
      }
    }
  ]
}
